activity_id,lat,long,brief,STUSPS,NAMELSAD,waterway_name,facility_name_ls,vessel_name,latlong_str
7165632,30.34237,-89.26422,"06MAR2021-While transiting in Bayou Portage in Bay St. Louis Mississippi, the CAPT CJ pushing 4 deck barges allided with the Bayou Portage Bridge fendering system.  The allision caused damage to the north west fendering system.  4 guide wall beams and 2 pilings were damaged and required repair.

As the vessel was transiting outbound Bayou Portage pushing 4 deck barges, the CAPT CJ was pusing through the Bayou Portage draw bridge.  While entering the bringe opening, the operator stated that unexpected weather pushed the tow toward the north west section of the bridge fendering system.  The tow struck the system and damaged the fender system guide wall and two pilings.  The operators stated that they were able to take corrective action and remove the barge off the fendering system and safely transit through the draw bridge.  The operators called the draw bridge to report they had allided with the bridge system and called Harrison County Bridge operators.  The bridge was shut down and operators performed tests.  All bridge tests were satisfactory.  The barges sustained no damage, the CAPT CJ sustained no damage.  

USCG IO contacted Harrison County Bridge dept and verified all damage and monetary amount.  Harrison County verified repairs to be made.",MS,Harrison County,['Saint Louis Bay'],['Bayou Portage Bridge'],['CAPT CJ'],"30.34237,-89.26422"
7166218,34.49629,-90.58738,"SITUATION:  0600L 28 MAR 21 - M/V EARL ETHERIDGE 6000 HP (Western Rivers Boat Management) with 20 loaded rock and grain barges in tow SB enroute MM 437 LMR reported an allision with the Helena, AR HWY 49 bridge at MM 661.7 LMR. The captain of the vessel stated that inclement weather from last night caused his tow to top around facing northbound and he pushed the tow in facing northbound north of the Helena bridge. The captain stated that rather than turning his tow southbound in the swift current north of the bridge, he decided to transit through the bridge backwards with the tow. The captain of the vessel stated that the STBD side of the STBD lead barge made contact with the LDB channel pier of the bridge causing some wires to break, with the tow remaining intact. The vessel is currently transiting south backwards with assist vessels M/V DAVID SOLOMON 1800 HP & M/V BIG DADDY 1200 HP (both Helena Marine Services) aiding in re-wiring the 08 loose barges inside the tow, so that the tow can be topped around safely facing south bound. The captain of the vessel reports no damage, injuries or pollution.

Investigation revealed the vsl had been pushed in facing NB. When the vsl got back U/W they needed to top around to a SB direction. Due to currents the vsl was unable to top around above the bridge. Master attempted to conduct astern operations through the bridge span before topping around. Vsl was caught in a cross current causing them to come off intended course and allide with the bridge.",MS,Coahoma County,['MISSISSIPPI-LO'],['HELENA BRIDGE'],"['EARL ETHERIDGE', 'HD 127']","34.49629,-90.58738"
7166361,36.97874,-89.14779,"On 31Mar2021, the ITV DEBORAH MILES, pushing 3 loaded asphalt flag barges was downbound on the Upper Mississippi River when the starboard set of the current caused the barge in the tow of the vessel to strike the pier of the Cairo Highway Bridge located at mile marker 1.3.  The allision caused damage to the starboard side of the starboard barge MM 18.  No pollution or injuries resulted from this incident.

Coast Guard investigation revealed the initiating event to be the allision with the bridge pier. Contributing factors include: 1) failure of the pilot to properly navigate his tow to transit the bridge span; 2) Failure to determine set of current to prevent allision with the bridge span.",IL,Alexander County,['MISSISSIPPI-UP'],['CAIRO BRIDGE'],"['MM 18', 'DEBORAH MILES']","36.97874,-89.14779"
7169124,36.77502,-76.29572,"On April 02, 2021, at approximately 1420 LMT, the Coast Guard initiated a preliminary investigation regarding the allision of the uninspected deck barge PM 21012 (Official Number 646827) with the east fender of the Gilmerton Bridge. The barge was towed by the towing vessel JOKER (Official Number 602379) in a pushing ahead configuration. The barge was approximately 296 long and 100 feet wide. The barge freeboard was approximately 19 feet. The on-scene weather conditions consisted of 20-25 MPH winds out of the north & northwest. The Master aligned the barge to transit through the bridge span with the assistance of the towing vessel DIAMOND COAST (Official Number 607968). The master of the JOKER directed the DIAMOND COAST to transit through the bridge and stand by the south side of bridge. The Master of the JOKER then maneuvered through the Gilmerton Bridge fender system when a fender on the port side of the barge allided with the east bank fender of the bridge.  Coast Guard Marine Inspector and Investigators attended the vessels, which were moored at Vulcan Materials. There was no damage to the barge or tug. A representative from the City of Chesapeake Bridge Division inspected the bridge, and did not observe any damage requiring repair.

As a result of its investigation, the Coast Guard determined the initiating event was the PM2102 allision with the Gilmerton Bridge east fender. The causal factors that contributed to this casualty include: (1) Environment: forecasted winds up to 25 MPH pushing along side the PM2102; (2) Person Condition: The Master of the JOKER was unfamiliar with the operator of the assist tug, and felt more comfortable maneuvering the barge without help from the DIAMOND COAST.

Recommend closing this incident investigation activity without a referral to enforcement.",VA,Chesapeake city,['Elizabeth River'],['GILMERTON HIGHWAY BRIDGE'],"['PM2102', 'JOKER', 'DIAMOND COAST']","36.77502,-76.29572"
7169473,27.4442,-82.68806,"On March 27, 2021, Sector Saint Petersburg received notification from the manager of the Longboat Pass Bridge concerning an allision wherein the barge JUSTIN HUNTER allegedly allided with and damaged the bridge fender system.  Bridge manager stated attempts to contact the involved vessel were unsuccessful and the Coast Guard did not receive a report of the casualty from the vessel operator.  Following the report, Investigating Officer conducted an investigation and observed blue paint on Longboat Pass Bridge fender system timbers consistent with the markings of the barge JUSTIN HUNTER, a vessel converted to be self-propelled from a deck barge by the addition of a hydraulic power unit. Investigating Officer was unable to approach JUSTIN HUNTER due to operation in shallow water.  

On March 29, 2021, Investigating Officer received subsequent notification alleging a second allision involving the Longboat Pass Bridge and the JUSTIN HUNTER.  Bridge Tender was able to provide accurate description of JUSTIN HUNTER as crew made temporary repairs to fender system.  Bridge Tender observed JUSTIN HUNTER operating as a self-propelled vessel.  

Investigating Officer contacted the manager of JUSTIN HUNTER and confirmed the vessel is a 140-foot long barge operating as a self-propelled vessel with two hydraulically driven auxiliary power units.  The manager confirmed the barge was over 5 tons, denied knowledge of the alleged allisions with the Longboat Pass Bridge and was unaware of the requirement to notify the Coast Guard of the allision.  During this conversation, the Investigating Officer discovered the JUSTIN HUNTER did not have a certificate of Documentation with a Coastwise Endorsement which is required since the vessel was operating as a self-propelled vessel while conducting Coastwise Trade, in accordance with 46 CFR Part 67.  Removal of the propulsion unit made JUSTIN HUNTER exempt from documentation requirements while operating on inland waters of the United States.  Furthermore, if JUSTIN HUNTER were measured by the Standard Measurement System as defined by 46 CFR Part 69, it would likely exceed 300 gross tons and if self-propelled, would require inspection under 46 CFR Subchapter I.  The auxiliary power units were subsequently removed from the vessel. 

Activity referred to enforcement for failure to immediately notify the Coast Guard of a Reportable Marine Casualty in accordance with 46 CFR § 4.05-1 and operation in coastwise trade without a Certificate of Documentation endorsed for coastwise trade as required by 46 CFR Part 67.",FL,Manatee County,['Sarasota Bay'],['Longboat Key Bridge'],"['RIKKI S', 'JUSTIN HUNTER', 'THELMA A', 'UNIT #530', 'UNIT #539']","27.4442,-82.68806"
7169846,39.4492,-90.6104,"On 29MAR21 at approx. 2305 the ITV BERNARD G. (O.N. 557869) was southbound approaching the Pearl Railroad Bridge at mile marker (MM) 43.2 on the Illinois River (ILR) pushing 15 loaded dry cargo barges (3 wide by 5 long) when the stern of the 4th barge back (MTC 622; O.N. 1180406) from the head of the tow in the starboard string allided with the bridge’s protection cell.  The allision caused the forward 12 barges to break free as a solid unit from the 3 face-up barges and float down river and came to rest along the left descending bank (LDB) at MM 42.0 ILR.  The Master was attempting to favor the right descending bank on his transit through the bridge span but got set over farther than he had anticipated, due to high water, and allided with the protection cell. The Capt was able to navigate with the 3 face-up barges and safely retrieve the block of 12 adrift barges with no further incident. Once the adrift barges were secured back in tow, the crew conducted a damage survey and discovered that the MTC 622 had suffered an 8 inch set-in on the portside of the barge that ran aft from the bow approx. 24 ft. As the barge was rear facing in the starboard string of the tow, the damage was contained to the portside bow of the barge. The bridge tender did not report any damage to the bridge or protection cell.",IL,Greene County,"['ILLINOIS', 'ILLINOIS']",['PEARL RAILROAD BRIDGE'],"['BERNARD G.', 'MTC 622']","39.4492,-90.6104"
7170505,35.12819,-90.07695,"SITUATION:  1422L / 02 APRIL 21 - SLMR received report from the M/V C. B. FORD (Choctaw Transportation, 1800 HP, twin screw) that while transiting N/B through the I-55 bridge (MM 734.7 LMR), with a helper boat, the currents pushed their STBD STERN barge into the LDB bridge pier. The allision resulted in all 06 loaded rock barges breaking free from vessel drifting down river. Two assist vessels (M/V JODY DAVENPORT and M/V JIM BARTON) arrived quickly to the scene and were able to catch the barges and have currently pushed the M/V C.B. FORD with all barges into the RDB bank at MM 733 LMR. The captain reported no visible damage to any barges in tow or to bridge pier.  No waterway Impact.

Investigation revealed that strong currents in the area were stronger than the C.B. FORD and the assist boat. Speed went to zero and the head top around. Not enough power.",AR,Crittenden County,['MISSISSIPPI-LO'],['MEMPHIS HIGHWAY BRIDGE'],"['C.B. FORD', 'CBX 2088']","35.12819,-90.07695"
7170867,38.87499,-77.04163,"On April 05, 2021 at approximately 1905 the inspected vessel NIGHTINGALE was underway with 18 passengers and 02 crew, the Master and a Deckhand, from Georgetown Waterfront in Washington, DC.  NIGHTINGALE was a 59 foot steel construction certificated small passenger vessel owned and operated by Frager Enterprises INC, last inspected October 28, 2020. The Master of NIGHTINGALE has worked onboard since April 2014 and has worked on the Potomac River since January 2013. At approximately 1930 NIGHTINGALE had completed it’s down bound excursion and turned about near Georgetown Channel Buoy No.6, to return to Georgetown Waterfront. The weather was observed to be between 66-70 degrees Fahrenheit, clear visibility, light breeze, and no noticeable current.

The Master was operating the NIGHTINGALE while using a calculator to complete paperwork when he dropped the calculator in the port pilothouse step well and reached down to pick it up. When the Master stood up he observed the NIGHTINGALE on course to allide with bridge span on Starboard Side. 

NIGHTINGALE allided with the Rochambeau Bridge on the Starboard Quarter; resulting in a scrape along the rub rail. No damage to the bridge, no pollution, and no personnel injuries.

The initiating event was found to be due to failure of Master to Maintain Proper Lookout. The Master was found to be operating the NIGHTINGALE while using their cell phone and a calculator to fill out paper work while in close proximity to a bridge.  Frager Enterprises has a policy in place prohibiting the use of cell phones by crew members while underway.  The Master's use of their cell phone and the calculator distracted the Master from recognizing that NIGHTINGALE was on course to allide with the 14th Street Bridge Complex. Failure of Master to Follow Company Policy. There is no defense beyond what was already in place by Frager Enterprises, prohibiting personal use of cell phones by the crew while underway.",DC,District of Columbia,['POTOMAC RIVER'],['14th Street Bridge Complex'],['NIGHTINGALE'],"38.87499,-77.04163"
7171835,40.79866,-91.09166,"On March 30, 2021 at approximately 2245 the ITV R. CLAYTON MCHORTER- was Southbound, transiting through the Burlington RR bridge (MM 403) and pushing 15 dry cargo barges transiting at a speed of approx. 2 knots. When the head of the tow was abreast of the right descending pier, the master pulled up to allow for set over to the left descending pier, the same maneuver he used at this bridge every time. The tow continued to set into the right descending pier and the master then came ahead to get as much tow past the pier. The third barge out in the starboard string struck the pier and boke 3 timbers. No other DPI.

As a result of the investigation, the Coast Guard determined that the cause of the casualty was the master was unable to access conditions properly to make it through without contact.",IL,Henderson County,['MISSISSIPPI-UP'],['BURLINGTON RAILROAD DRAWBRIDGE'],['R. CLAYTON MCWHORTER'],"40.79866,-91.09166"
7174507,38.95607,-74.87381,"At approximately 1743 EST on April 10th, 2021, the research vessel BROOKS MCCALL allided with the Middle Thorofare Bridge (formally the 2-Mile Bridge). The vessel was inbound to Lund’s Fisheries from sea, the tide was flooding, and winds were light. The BROOKS MCCALL’s beam is approximately 40’, and the bridge span is approximately 50’ leaving approximately five (5) feet on each side of the vessel as it transited through the Middle Thorofare Bridge.  The BROOKS MCCALL was set to its port and contacted the bridge fendering system. The BROOKS MCCALL’s lower USBL brace was damaged and the bridge fendering system was damaged as a result of the impact. The bridge tender did not realize that the vessel had allided with the bridge until the vessel called the bridge on the radio. The damage from this allision was minor in nature. 

At approximately 1808 EST on April 11th, 2021, the BROOKS MCCALL had a second allision with the Middle Thorofare Bridge while conducting its outbound transit from Lund’s Fisheries to sea. The tide was flooding, and the winds were again light. Two videos of this allision were captured and have been added as evidence to this case. In the videos it is evident that the vessel’s fenders were the only part that contacted the bridge, but that was enough to do some damage to the bridge. No damage occurred to the BROOKS MCCALL during the second allision, and minor damage occurred to the Middle Thorofare Bridge. The damage was thoroughly documented in the Bridge Commission’s report, and estimated to be less than $10,000 for both allisions. 

In accordance with MSM Vol. V, A5E, this investigation is classified as a Data Collection, and no analysis, conclusion(s), or recommendation(s) will be developed.",NJ,Cape May County,['Grassy Sound'],['2 Mile Bridge'],['BROOKS MCCALL'],"38.95607,-74.87381"
7174651,39.44486,-91.03315,"On 13 April 2021 at approximately 0945, the ITV COOPERATIVE MARINER (ON 627829) was transiting up river, pushing 15 (12 empty, 3 loaded) dry cargo barges when the PVHC 34B (ON 1058138; empty dry cargo barge) allided with the turntable cell of the Louisiana Railroad Bridge at approximately mile marker (MM) 282.1 on the Upper Mississippi River (UMR). Higher than normal river currents and winds in the area caused the tow to be set over to port, near the turntable of the Louisiana Railroad Bridge, which resulted in the port side of the PVHC 34B alliding with the bridge. No damage to the bridge or the barge was reported.",MO,Pike County,['MISSISSIPPI-UP'],['LOUISIANA RAILROAD DRAWBRIDGE'],"['COOPERATIVE MARINER', 'PVHC 34B']","39.44486,-91.03315"
7175455,32.19869,-93.44803,"On 13 APR 2021 at approximately 1900 local time, the ITV MISS SUSAN, pushing 01 loaded hopper barge, allided with the KC Railway bridge in Loggy Bayou off of MM 194 of the Red River. There was no damage to the barge, however, portions of concrete were cracked on the piling for the bridge. Bridge inspectors determined that the bridge was still operational.

The cause of this incident was determined to be an unusually swift current pushing the head of the barge into the bridge piling.",LA,Red River Parish,[nan],['KC Railway Bridge'],"['MISS SUSAN', 'MEM 108']","32.19869,-93.44803"
7176810,26.45433,-81.952,"On April 16, 2021, Coast Guard Detached Duty Office Fort Myers Beach received a notification concerning the commercial fishing vessel LIBERTY I (1119954) alliding with the Matanzas Pass Bridge in Fort Myers, Florida.  LIBERTY I was disabled and under tow of the commercial fishing vessel JENNA DAWN (594192) at the time of the allision.  During the investigation, the Investigating Officer determined LIBERTY I initially lost propulsion on April 14, 2021, due to the failure of the injection pumps on the number two and six cylinders.  Following loss of propulsion, the vessel anchored and attempted repairs.  The operator of LIBERTY I failed to initially report to the loss of propulsion to the Coast Guard in accordance with 46 CFR 4.05-1.  After unsuccessful attempts to repair LIBERTY I while at anchor, JENNA DAWN was dispatched to tow LIBERTY I to berth.  While the tow was passing under the Matanzas Pass Bridge, the outrigger on LIBERTY I contacted and subsequently damaged a metal accommodation ladder and walkway affixed to the bridge.  Following the allision, the tow moored without further incident.  No injuries, pollution or waterway obstructions noted during this marine casualty investigation.  Activity referred for enforcement for failing to report the initial loss of propulsion experienced on April 14, 2021.",FL,Lee County,['Estero Bay'],['Matanzas Pass Bridge'],"['LIBERTY I', 'JENNA DAWN']","26.45433,-81.952"
7177876,41.63928,-87.56649,"On April 18, 2021, at approximately 0430, the towing vessel MIKE PLANCHE (O.N. 563295) was underway pushing a tow of 5 loaded dry cargo barges northbound on the Calumet River when the vessel's radar dish allided with the underside of the Norfolk Southern RR Bridge at MM 325.2. The allision bent the frame for the vessel's radar lift assembly, and affected the radar display in the pilot house. No injuries or damage to the bridge were reported.

As a result of its investigation the Coast Guard has determined that the initiating event in this casualty was the frame for the radar lift assembly on board the MIKE PLANCHE alliding with the underside of the Conrail Railroad bridge, followed by damage to the radar lift assembly frame.",IL,Cook County,['IL WWY SAG'],['ConRail Railroad Bridge'],['MIKE PLANCHE'],"41.63928,-87.56649"
7178188,39.44439,-91.03452,"On 12 April 2021 at approximately 1345, the ITV ROBIN B. INGRAM (ON 617985) was transiting up river, pushing 13 barges (12 empty dry cargo, 1 loaded dry cargo) when one of the empty dry cargo barges in the tow allided with the turntable of the Louisiana Railroad Bridge at approximately mile marker (MM) 282.1 on the Upper Mississippi River (UMR). The Upper Mississippi River was experiencing higher than normal river conditions which caused the tow to set over toward the turntable of the Louisiana Railroad Bridge. This set caused the IN 165496 (ON 1268942), the aftermost barge in the port string, to allide with the turntable of the Louisiana Railroad Bridge. No damage to the bridge or the barge were reported.",MO,Pike County,['MISSISSIPPI-UP'],['LOUISIANA RAILROAD DRAWBRIDGE'],"['ROBIN B. INGRAM', 'IN165496']","39.44439,-91.03452"
7178294,36.97822,-89.14878,"On 17APR2021 at approximately 1335 hours, ITV TONY ESPINOZA (ACBL, 549164, No COI) was d/b pushing 20 loaded barges (19 grain, 1 ethyl alcohol) at MM 1.3 UMR when the lead port barge allided the tow of the anchored ITV WASHINGTON while on approach to the Cairo Bridge. While attempting to correct, the port lead barge allided with the Cairo Bridge, causing eighteen of the barges to break away. The barges were recovered by an assist vessel in the vicinity and it was determined that seven of the barges sustained damage of varying degrees. Lightering operations commenced on the two most damaged barges and they were brought to Cairo, Il for drydock repairs. Initial damage estimate to the barges is $300,000. 

Coast Guard investigation revealed the initiating event to be the Allision. Contributing factors include: 1) lack of awareness of current river conditions.",IL,Alexander County,['MISSISSIPPI-UP'],['CAIRO BRIDGE'],"['WASHINGTON', 'TONY ESPINOZA', 'AEP 7426']","36.97822,-89.14878"
7179196,36.72367,-76.18633,"On April 17, 2021, at approximately 0549 LMT, the uninspected deck barge U860 (Official Number 1210473) allided with the Centerville Turnpike Bridge fender. U860 was being pushed ahead by the inspected towing vessel DMO LISTO (Official Number 600327). The vessels were underway in the Albemarle - Chesapeake (A&C) Canal. The Master had direction and control of the vessel. He directed the deckhand on watch to serve as a lookout on the bow of the barge. The tug was equipped with a port and starboard spot light, which the Master pointed to the bridge fenders. The observed weather conditions consisted of clear skies, 2 knot winds from the north, and slack tide. The vessels transited through the Centerville Turnpike Bridge while making 4 knots headway. The starboard quarter of the barge allided with the north fender. The bridge tender hailed the tug over VHF, and informed them of the allision. The Master acknowledged that the incident occurred. The bridge tender notified the master they would inform the bridge supervisor of the incident. The City of Chesapeake Bridge Division sent an engineer to the bridge. There was no damage observed to the fender above the waterline. The following day, the Bridge Tender informed the Sector Virginia Command Center of the incident. Coast Guard Investigating Officers attended the vessel, and conducted a propulsion, steering, and navigation equipment check. All systems were found in good working order. There was no damage to the bridge.

As a result of the investigation, the Coast Guard determined that the initiating event was the bridge allision. The causal factors that contributed to this casualty include: (1) pre-condition: lack of familiarity with waterway; (2) production: attention error, master failed to account for the effects of bank cushion and stern suction while transiting through the Centerville Turnpike Bridge span.

Recommend closing this incident investigation activity with a referral to enforcement.",VA,Chesapeake city,['A. & C. Canal'],['CENTERVILLE TURNPIKE BRIDGE'],"['DMO LISTO', 'U 860']","36.72367,-76.18633"
7180485,36.01818,-88.00073,"On April 4, 2021, at approximately 0500, the up bound ITV BOBBY THOMPSON’s tow allided with the channel span piling (right descending) on the New Johnsonville Bridge at mile marker 100, resulting in all 15 barges going adrift. The vessel was pushing 15 loaded hopper barges (7 corn, 6 soy bean, 2 wheat).  The barges went aground at mile marker 99.2 on the left descending bank, 600' outside of the channel. An independent surveyor and assist vessel, with crane, were necessary to transfer some cargo to remove two of the vessels from on ground.  After all 15 barges were surveyed, two were found to be damaged.  The two barges required a spud barge and crane to offload some of the cargo.  All barges were removed by morning of April 5, 2021.

The investigation determined the initiating event was the allision with the New Johnsonville Bridge, after the pilot was unable to maintain steerage against the heavy current.  Also causal to the allision was that, according to the pilot, the towboat was underpowered (4200 overall HP) for the conditions while pushing 15 loads.  Secondary events included the breaking of the tow couplings and barges going adrift and going aground.  Damage was caused to two of the barges estimated at $60000.  No damage was noted to the bridge or to the tow vessel.",TN,Humphreys County,['TENNESSEE'],['CSX Railroad Bridge'],"['BOBBY THOMPSON', 'ING4716', 'ING4765', 'ING2401', 'IN075129', 'IN085010', 'IN085240', 'IN095024', 'IN126406', 'IN126452', 'REBECCA RAYMOND', 'IB1954', 'IN166466', 'IB1314']","36.01818,-88.00073"
