activity_id,lat,long,brief,STUSPS,NAMELSAD,waterway_name,facility_name_ls,vessel_name,latlong_str
7424234,34.57261,-77.27187,"On March 28, 2022, at approximately 2320 EDT, the towing vessel JOHN PARRISH (O.N. 543973) was underway on the Intracoastal Waterway (ICW) pushing ahead two uninspected barges, DIDAPPER 78 (O.N. 1306750) and NDC 160 (O.N. 1272830) loaded with miscellaneous cargo when NDC 160 allided with the fendering system of the Onslow Beach Swing Bridge. The incident occurred as the tow was transiting northbound en route to Chesapeake, VA with four crew aboard. As the tow approached the swing bridge, the Master of JOHN PARRISH made contact with the bridge tender and requested a bridge opening. The bridge operator agreed and initiated the opening process of the swing bridge. The swing bridge is controlled by a computer and the bridge operator follows the opening sequence by the visual display in the monitor. From start to finish, the opening sequence takes about five minutes (approx. 3 minutes for the bridge to complete its turn). No problems were reported with the opening of the bridge or its operation. 

The Master of JOHN PARRISH continued on course at the slowest speed since the ICW was at high tide and the current was about to 2-3 knots flowing in the direction of the tow. As the tow began to get closer to the bridge, the Master centered up the barges and tug (approximately 2000’ prior) with the assistance of two lookouts, which were standing forward near the bow of NDC 160 for the purpose of communicating distance, providing guidance, and to line up for transit through the more restrictive bridge draw area. 

As the Master continued on course, he placed both throttles back to idle to take more speed off when he noted a strong following tide and the tow was still maintaining speed despite the change in handle position (placing throttles to idle). At this time, the lookout noticed the tow had drifted off center and was closer to the starboard side of the fendering system and contacted the Master over handheld radio (channel 18) to come more to port. The Master acknowledge the communication. At approximately 200’ from the bridge, the Master started taking the port and starboard main engines in and out of gear, as he had done in the past successfully to assist with slowing the tow and for making course corrections. The tow shifted, but was not notable.

At approximately 70’ from the entrance to the fendering system, the Master saw the tow was still too close to the east fendering system, and made a slight turn and gave a throttle increase to port. The lookouts again, notified the Master the tow needed to come more to port. As the tow transited through the bridge, the first barge (DIADAPPER 78) made it through without incident; however, the starboard bow corner of NDC 160 allided with the east fendering system. After the allision occurred, the Master had both main engines at clutch and then gave slight throttle and turned the rudder to ease off the fender. This caused the port side of NDC 160 to shift and allide with the western fendering before finial clearing of the bridge.   

The tow made it through the bridge without any further incident and pushed up on the western bank approximately one half a mile until morning. The Master had the lookouts check all voids on the tug and both barges. No damage, injuries, or pollution was reported to the tug or barges. 

The swing bridge operator called the Master of JOHN PARRISH and notified both sides of the fendering had been struck and had visible damage. Approximately 10 feet of the fendering system, including boarding along the bulkhead on the east side was broken and missing. Additionally, a navigational light, wiring, and fender supports were damaged and missing. The bridge tender notified the Coast Guard due to the potential hazard to navigational, as the navigational light was extinguished and boards were missing.

As a result of its investigation, the Coast Guard has determined that the initiating event for this casualty was the tow drifting sideways after the throttles were put into clutch. This was followed by the barge allision with the bridge fendering system. The causal factors that contributed to this casualty were: (1) current conditions, (2) restricted visibility from the bridge, (3) narrow bridge opening, and (4) Master's complacency/situational awareness.",NC,Onslow County,['Onslow Bay'],['Onslow Beach Swing Bridge'],"['JOHN PARRISH', 'NDC 160', 'DIDAPPER 78']","34.57261,-77.27187"
7424401,42.06497,-90.16837,"30MAR2022, Sector Upper Mississippi River Command Center received notification of a marine casualty that occurred, at approximately 2245, onboard the ITV R Clayton McWhortor on 30MAR2022. The casualty occurred while the vessel was headed northbound on the Mississippi River at MM 535. The casualty involved the ITV R Clayton McWhortor allided with the sheer fence on the port side of the Sabula R.R. Bridge with his port lead barge reported to be caused by getting too far under starboard pier and had to steer around bridge pier. No damage was found to the bridge. Barge was damaged, fitting broke,doubles still intact.

The Coast Guard determined that the casualty occurred as a result of the pilot miscalculating his trajectory when lining up his tow to transit the Sabula Railroad Bridge.",IA,Jackson County,['MISSISSIPPI-UP'],['SABULA RAILROAD DRAWBRIDGE'],['R. CLAYTON MCWHORTER'],"42.06497,-90.16837"
7425308,30.15535,-91.33138,"On April 1st, 2022 the towing vessel SALVATION (O.N. 1218049) was underway northbound on the Morgan City Port Allen Route near mile marker 38 pushing 6 loaded rock barges. It was the pilots first time transiting on the MCPA. At approximately 1255, the pilot of the SALVATION steered to transit through the Bayou Sorrel Bridge. At approximately 1300, the starboard lead barge allided with the bridge.

The pilot notified the USCG.  The crew inspected the barges and found no signs of damage. LADOT reported that the control arm to the bridge was damaged and needed to be replaced. They did not know the exact cost of the control arm because they had a spare but stated that it’s not more than 25k. No pollution, or injuries resulted from this casualty.

Through its investigation, the Coast Guard determined that the initiating event to be allision with the bridge. The causal factor that contributed to this casualty include: (1) The pilots inexperience lead him to misjudge the clearance he had on the starboard side.",LA,Iberville Parish,['IWW-ALT'],['BAYOU SORREL BRIDGE'],['SALVATION'],"30.15535,-91.33138"
7425692,30.29515,-87.63171,"On April 5, 2022 at approximately 1330LT, the JOHN FORREST TERRAL was underway conducting barge movements when the RM 3306B sand barge broke free and slowly drifted down the ICW, alliding with the Orange Beach Toll Bridge. The tug successfully retrieved the barge and no damage was found on the barge and less than $25K damage was found on the top timber of the bridge fendering system in which is allided. The bridge remained open and operational.

Through it's investigation the Coast Guard determined the initiating event was when the barge went adrift down the river followed by alliding with the bridge fendering system.",AL,Baldwin County,['GIWW-EAST'],['Orange Beach Toll Bridge'],"['JOHN FORREST TERRAL', 'RM 3306B']","30.29515,-87.63171"
7426254,36.77483,-76.29467,"On April 6, 2022, at approximately 1457 LMT, the inspected towing vessel VENGEANCE (ON: 506543) was pushing ahead the uninspected deck barge TZC 102 (ON: 635163) northbound on the Elizabeth River. The tow was coming from Precon Marine, Chesapeake, VA, headed to Hampton Flats, Hampton, VA. The barge was loaded with sand for a bird nesting project. The weather was partly cloudy with full visibility. There was sustained wind of 12 knots in an East direction. The tow was approaching the Norfolk Southern Railroad Bridge No.7, proceeding in the middle of the river, when it was set to Starboard by a gust of wind. The Master of the towing vessel was unable to correct the direction of the vessel enough and the barge's starboard aft quarter allided with the bridge fendering system. The barge suffered scuff marks on the rub rail without tangible damage. The bridge fendering system suffered minor damage and remained operational. The bridge damage was limited to a bent grating, estimated at $2,000. Distraction due to the use of wireless electronic devices was ruled out as a causal factor.

As a result of its investigation, the Coast Guard has determined that the initiating event for this casualty was the allision of the barge with the bridge. The causal factors that contributed to this casualty include: (1) Failure of Master to navigate the vessel away from the fixed object.

Recommend closing this incident investigation activity with a referral to enforcement.",VA,Chesapeake city,['Elizabeth River'],['NORFOLK SOUTHERN R/R BRIDGE 7'],"['TZC 102', 'VENGEANCE']","36.77483,-76.29467"
7429198,40.68183,-89.59417,RCVD a report from the ITV AGGIE C that they allided with the Cedar Street bridge protection cell at MM 161.5 ILR at 0145 LCL this morning. VSL had 3 empty hopper barges in tow. VSL reports no damage to VSL or bridge. VSL states the wind pushed the tow into the protection cell.,IL,Tazewell County,['ILLINOIS'],['CEDAR STREET BRIDGE'],"['AGGIE C', 'JPF 5R']","40.68183,-89.59417"
7430277,30.50705,-91.19874,"On April 11, 2022, at approximately 2025 hours, Towing Vessel RON W CALLEGAN was pushing 33 loaded freight ""hopper"" barges downbound on the Lower Mississippi River and attempting transit through the center span of the US-190 Bridge near Mile Marker 234 when its lead barge allided with the west pier of the span.

The starboard lead barge, BIG 0678, sustained severe damage, but was able to be towed to the right descending bank before it sank. The second-to-starboard lead barge,BIG 0663, also allided with the west pier of the span during a subsequent allision and sustained hull damage. The allisions caused several barges to break away from the tow. Barges BIG 2010B, NBI9712B, BIG 0643, BIG 779B, and FINN 0100 sustained damage either from alliding with the bridge pier or colliding with each other. The remainder of the breakaway barges were recovered without further incident. Louisiana DOTD inspected the bridge and determined that there was no significant damage to the bridge.

As a result of this investigation, the Coast Guard has determined that the initiating event for this casualty was the allision of BIG 0678 with the US-190 Bridge, which caused the subsequent events of the allision of BIG 0663 with the US-190 Bridge, several barges being set adrift, several subsequent collisions between barges, and miscellaneous allisions between adrift barges and the bridge. The causal factors to this casualty include: (1) Incomplete repairs to ballast piping of the aft voids; (2) RON W CALLEGAN’s draft was higher than normal, decreasing maneuverability; (3) The Mississippi River was in “High Water” condition near Wilkinson Point and the Highway 190 Bridge; (4) The Master chose an improper maneuver for navigating Wilkinson Point; and (5) The failure of the Master and Port Captain to properly address maneuverability issues with the RON W CALLEGAN.",LA,West Baton Rouge Parish,['MISSISSIPPI-LO'],"['US 190 Hwy Bridge on Mississippi River,']","['RON W CALLEGAN', 'NBI9712B', 'BIG 779B', 'BIG 643', 'BIG 663', 'BIG 678', 'FINN 100', 'BIG 2010B']","30.50705,-91.19874"
7431001,40.18754,-74.01016,"At 1630L the Command Center received a report from operator of Ocean Ave Bridge that a 25ft center console vessel allided with the bridge with its outriggers. Bridge communications attempted to contact the vessel but weren't able to establish communications. Bridge operator was able to record NJ1988CP from the side of the boat and stated it was headed outbound Shark River and proceeded north. The Bridge is still operational, but is in auxiliary mode. Bridge maintenance supervisor for the Monmouth Country Draw Bridge Division and will be updating Sec DB Duty IO of any damages.  Bridge authority reported no damage to the understructure to the lift bridge.  

Vessel owner failed to submit a CG-2692 as requested. Vessel owner failed to submit statement or interview.  As a result of the noted failures, case refered to enforcement.",NJ,Monmouth County,['Unnamed Bay or Estuary or Ocean in New Jersey'],['Ocean Avenue Bridge'],['NJ1988CP'],"40.18754,-74.01016"
7433858,43.78767,-91.2585,"On 09 APR 2022, USCG recieved a report from the La Crosse railroad bridge at river mile marker 699.8 UMR that the ITV CAPT PHILLIP BOX made contact to the bullnose of the bridge. The bridge could not determine if there was damage, and the ITV reported no damage to the stern barge that landed on the bullnose. The ITV CAPT PHILLIP BOX had 12 loaded cement barges in tow. Upon reaching out to the La Crosse Railroad Bridge, they failed to identify if damage had occurred or provide any estimated amounts of damage.  


WEATHER SOURCE: NWS, WIND SPEED: 7 KTS, WIND DIR: 320 T, KTS, AIR TEMP: 40 F, VISIBILITY: 10.0 NM, WATER CONDITION SOURCE: NOAA, WATER TEMP: 36 F

Conclusion:  ITV CAPT PHILLIP BOX was headed northbound through La Crosse Railroad Bridge.  The PIC noticed that up river he would have trouble navigating if he failed to make immediate corrections using the La Crosse Railroad Bridge to assist him in pivoting his vessel and tow, due to high current in the area.  PIC stated that he attempted several times to communicate via radio and cellphone with the bridge but was unable to succeed. PIC made contact with the La Crosse Railroad Bridge Bullnose and continued navigating safely.  No associated damage, pollution, or injuries resulted in this case.",MN,Houston County,['MISSISSIPPI-UP'],['LACROSSE RAILROAD DRAWBRIDGE'],['CAPT. PHILLIP BOX'],"43.78767,-91.2585"
7433875,29.69285,-91.21158,"On April 18, 2022 at approximately 0655 (LMT), the tank barge LMB 103 allided with the fendering system of the Morgan City Railroad Bridge while being pushed by the towing vessel CAPTAIN BOUDREAUX. The vessel was transiting from the Halliburton Dock in Berwick, LA to Galveston, TX pushing four red flag barges loaded with liquid mud. However, the vessel was restricted by the highwater conditions for transiting through the Morgan City Triple Span Bridges set forth by the Local Notice to Mariner 15/22. Since there were no available assist vessels in the area to assist in the transit through the bridges, the relief captain decided to break up the tow and ferry two barges at a time down to Central Boat Rentals, before remaking the tow and heading to Texas. The ITV CAPTAIN BOUDREAUX was making its run southbound with the first two barges (LMB 109 and LMB 103) when the stern barge LMB 103 allided with the northeast section of the fendering system of the Morgan City Railroad Bridge. The relief captain was aware of the current shifting the tow when transiting through the Railroad Bridge but had only transited southbound without an assist vessel a couple of times. Upon questioning, the relief captain stated that he knew that he was supposed to stay on the western side of the channel when transiting through the bridge because of the current. However, he decided to transit in the middle of the channel because he believed the tow was small enough to not be affected by the current. The vessel was transiting at approximately 7 mph following a current that was approximately 2 mph. When the relief captain realized that the tow was being sucked to the eastern side of the channel towards the Railroad Bridge, he attempted to reverse but still allided with the fendering system. The impact of the allision resulted in two broken tow wires and scrapes to the port stern of the LMB 109. The tow wires were replaced with extras kept onboard. There was only minimal damage to the fendering system reported by BNSF. There was no report of any pollution or injuries as a result of this incident. 

During the course of the investigation it was discovered that the relief captain did not have the radar observer endorsement on his credentials. The company was notified of the missing endorsement and educated on ensuring all credentialed mariners had the proper endorsement for the position hired. The vessel was allowed to retrieve the last two barges from Halliburton Dock and remake it tow under the captain with the proper credentials while the company determined the best route for continuing transit with only one fully credentialed captain. After determining to transit back to Texas using only the master as the qualified captain of the vessel in 12 hour shifts, the vessel was allowed to continue its transit by the marine inspectors at MSU Morgan City (MISLE# 7433600).

As a result of its investigation, the Coast Guard has determined that the initiating event for this casualty was the allision between the tank barge LMB 103 and the Morgan City Railroad Bridge while it was being pushed by the ITV CAPTAIN BOUDREAUX. The casual factors that contributed to this casualty include:
1) The miscalculation of the relief captain in maneuvering the ITV CAPTAIN BOUDREAUX under the Morgan City Railroad Bridge that resulted in the tow being pulled towards the eastern side of the channel and into the fendering system of the Morgan City Railroad Bridge.
2) The high water conditions of the waterways that increased the current flowing south through the Bridge complex and created a suction effect near the fendering system of the bridge that pulled the tow towards the eastern side of the channel.",LA,St. Mary Parish,['IWW-ALT'],['MORGAN CITY SP RR BRIDGE'],"['LMB 103', 'CAPTAIN BOUDREAUX']","29.69285,-91.21158"
7435397,43.82597,-91.26978,"On 09 APR 2022 at 0100, USCG SUMR received a report from the La Crosse Railroad Bridge (River Mile Marker 699.8 UMR) that the ITV Arne Christiansen pushing 04 liquid fertilizer barges, specifically barge ST 2805, allided with the fendering system.  Upon receipt of report, at 0130 MSD ST PAUL personnel contacted the involved parties.  ITV Arne Christiansen was contacted first and reported no pollution, no injuries, and no damage to the tug or barges.  La Crosse Railroad Bridge was also contacted and reported very minor timber damage but had said that a more experienced bridge inspector would be checking the bridge to verify.  La Crosse Railroad Bridge failed to provide an updated damage assessment.  
WIND SPEED: 8 KTS, WIND DIR: 310 T, GUST SPEED:  KTS, AIR TEMP: 30 F, VISIBILITY: 10.0 NM, SEA LEVEL PRESSURE:  SKY CONDITION: CLEAR, WATER TEMP: 34 F

Conclusion:
Upon investigation, it was noted that the Captain/PIC of the ITV Arne Christiansen had it's tow set to port, caused by an unexpected speed increase due to an increased current.  This caused the barge ST 2805 to rub up against the bridge fender.",WI,La Crosse County,['MISSISSIPPI-UP'],['LACROSSE RAILROAD DRAWBRIDGE'],['ARNE CHRISTIANSEN'],"43.82597,-91.26978"
7435544,38.67461,-90.1866,"On 17APR22 at approx. 0015 the ITV GARRON L SNEED (O.N. 560609) was northbound with 10 empty dry cargo barges on the Upper Mississippi River (UMR) passing under the center span of the Merchants Railroad Bridge at mile marker (MM) 183.2 when the tow was set off to starboard and the ITV grounded on a partially submerged L-dike. The Capt was able to work the ITV off of ground; however, once he was free the head of the tow had topped around towards the left descending bank (LDB). With the tow almost perpendicular to the flow of the UMR, it drifted down onto the Merchants Bridge and allided with a mooring cell set up on the north side of the IL side bridge pier of the center span. The allision caused the tow to break apart into a single block of 6 barges and 4 individual barges. The Capt was able to recover the block of 6 and 1 of the adrift barges and take them down to the SCF-Lewis and Clark - MRT Fleet at MM 182.0 without further incident; however, the 3 remaining individual barges (ED 1, O.N: 1030817; CTC0119, O.N: 1109839; MEM 5129, O.N: 1066471) floated down river and allided with the McKinley Bridge at MM 182.5. Two assist boats working downriver were able to corral the 3 adrift barges and take them in tow to the same MRT Fleet as the GARRON L SNEED. 
 
The tow was destined for a coal dock along the right descending bank (RDB) at MM 184.5 and had to utilize the alternate span (center span) of the bridge to avoid the L-dike that protrudes from the tip of the peninsula at MM 184.2 running south to MM 183.3 which separates the Chain of Rocks from the Chain of Rock Canal. As the tow was approaching the center span, the Capt set the tow off a bit further from the MO side pier of the center span due to a moored work-flat (barge), M-8003 (O.N. CG867290). Once the head of the tow was clear of the bridge span the winds picked up from 5 kts to approx. 10-15 kts off of the portside of the tow (from West).  Additionally the natural flow of the river had the current pushing on the portside head of the tow which aided in setting him off to the starboard. The resulting grounding caused the ITV to breach the #3 starboard fuel tank and barge breakaway caused damage to the 3 adrift barges that allided with the McKinley Bridge. The GARRON L SNEED was taken to dry-dock at National Maintenance in Wood River, IL. The 3 damaged barges will remain in the fleet until dock space is opened up to make repairs.",MO,St. Louis city,['MISSISSIPPI-UP'],"['MCKINLEY BRIDGE', 'MERCHANTS RAILROAD BRIDGE']","['CTC0119', 'GARRON L SNEED', 'ED 1', 'MEM 5129', 'M-8003']","38.67461,-90.1866"
7438407,39.45772,-90.6103,"On 24 April 2022 at approximately 0645, the ITV CHEYENNE (ON 1294381) was transiting down river, pushing 03 loaded red flag barges at approximately mile marker (MM) 43.2 on the Illinois River (ILR) when the starboard stern of the ITV allided with the up river, right descending bank protection cell of the Pearl Railroad Bridge. Stronger than normal currents caused the CHEYENNE to get set over towards the right descending side of the channel and, although the vessel and tow nearly cleared the bridge, the corner of the starboard stern of the CHEYENNE allided with the protection cell. The allision caused the starboard facing wire between the ITV and adjacent barge to part; all other rigging remained intact and no barges broke free. The ITV CHEYENNE subsequently pushed in at MM 42.7, replaced the parted facing wire and inspected the ITV for damage. No damage to either the ITV or the protection cell, later examined by bridge inspector, was identified and the CHEYENNE continued its downriver voyage.",IL,Greene County,['ILLINOIS'],['PEARL RAILROAD BRIDGE'],['M/V CHEYENNE'],"39.45772,-90.6103"
7439100,40.02307,-90.43408,"At 1450 LCL, The M/V W. Red Harris allided with the Beardstown R.R. Bridge at ILR MM 88.8 while en-route S/B to Saint Louis, MO pushing 15 loaded dry barges for Marquette Transportation. Besides broken wires, there is no damage, pollution or injuries reported. M/V Harris will continue transit after wires have been repaired. 2692 requested. MSD Peoria, WWM, Bridge Branch, CDO briefed.  

A fracture on the barge was later discovered, estimated damage of $300.",IL,Schuyler County,['ILLINOIS'],['BEARDSTOWN RAILROAD DRAWBRIDGE'],"['W RED HARRIS', 'LTD 361']","40.02307,-90.43408"
7439897,29.21215,-95.20752,"On April, 26, 2022, at approximately 0455 the T/V COTTON was pushing the barge WEB137 out bound under the Chocolate Bayou 2004 Bridge. Vessels all around white mast light made contact with the bottom of the bridge. No damage to the bridge was reported, and the light was replaced. Vessels light is 49ft high, and the bridge is 50ft. Vessel has transited under the bridge many times without incident but  vessel was slightly to the right side of the channel so max bridge high of 50ft was reduced; due to the couverture of the bridge. The barges bow was slightly to the left side of the channel and the tugs stern was slightly left in the channel, compensating for the 22-25MPH southernly wind; to go straight. Flotilla as a whole was in the center of the channel. No pollution or injury was reported and a Cg-2692 was received.",TX,Brazoria County,['Chocolate Bay'],"['FM 2004 Hwy bridge on Brazos River, Lake']",['TOM COTTON'],"29.21215,-95.20752"
