activity_id,lat,long,brief,STUSPS,NAMELSAD,waterway_name,facility_name_ls,vessel_name,latlong_str
6886799,37.13844,-88.6885,"On 08JAN2020 @ approximately 0445 hrs. the ITV CAPT. CHASE (LA Carriers, 589861, 2400 HP, COI pends) was down-bound at MM 940.8 OHR (Metropolis, IL) pushing 1 empty deck barge when the master on the navigational watch failed to check the air gap and river stage for the I-24 Bridge and navigated through the low water span of the bridge. The vessels radar dome struck the bridge causing 5,000.00 damage to the vessel. The current river stage at that time was 32FT which requires vessels to use the high water span of the bridge.  


Coast Guard investigation revealed the initiating event to be the bridge allision. Contributing Factors include: 1) Loss of Situational awareness 2) Failure to use all available means for transit on Western Rivers

Case was Refered for Enforcement Alleged Negligence",KY,McCracken County,['OHIO'],['I-24 HIGHWAY BRIDGE'],['CAPT. CHASE'],"37.13844,-88.6885"
6888380,38.62882,-90.17904,"On 01MAY19 at approx. 0145 the ITV SCF EXPLORER (ON: 1266591) was down bound at mile marker (MM) 180 on the Upper Mississippi River (UMR) with 9 dry cargo grain barges when the ITV allided with the underside of the Eads Bridge. As the tow was passing through the center span, the appurtenances on the flying bridge made contact with the underside of the bridge damaging the spot light, radar, and handrail.  At the time of the casualty, the UMR was in extreme high water which would require ITVs and tows to pass though the Eads Bridges dead center of the span to avoid making contact with the bridge’s arched construction. Through the course of the investigation it was determined that the Master miscalculated the ITV’s air draft and had been set off towards the right descending bank (not aligned to the center of the bridge span) resulting in the allision. No damage to the Eads Bridge occurred and the SCF EXPLORER continued down bound and moored at the SCF Ship Yard for repairs at MM 177 UMR.",MO,St. Louis city,['MISSISSIPPI-UP'],"['EADS BRIDGE', 'SCF Services Drydock']",['SCF EXPLORER'],"38.62882,-90.17904"
6889380,32.31431,-90.9046,"M/V MISS LYNN 2000 HP (Terral River Services) with 06 loaded rock barges in tow SB enroute Mobile, AL reported an allision with the Vicksburg R/R bridge at MM 435.8 LMR. The captain of the vessel stated that the cause of the allision was due to dense fog creating low to no visibility while approaching the bridge. The vessel struck pier #4 of the R/R bridge with the lead barge (SAVG 101) of the port string  on the LDB channel span causing all 06 barges to break away which are now under positive control by assist vessels. SAVG 101 suffered damage to port bow quarter, including holes in the hopper, with a vertical crack the length of the hold.  Total amount of damage estimated to be $150K. No other barges damaged.  No pollution or injuries.",MS,Warren County,['MISSISSIPPI-LO'],['VICKSBURG RAILWAY AND HIGHWAY BRIDGE'],"['MISS LYNN', 'SAVG 101B']","32.31431,-90.9046"
6889410,38.45259,-75.06419,"The MD 3629 BL is an uninspected construction barge and push boat operated by RG Murphy Construction LLC.  On 27 November 2019, the vessel was transiting the Assawoman Canal located near Fenwick Island, DE.  At approximately 1043, the vessel struck the route 54 bridge causing approximately $22,000 damage to the bridge.
  
This incident was never reported to the U.S. Coast Guard.  Recommend incident referred to MISLE Enforcement for a Letter of Warning.",DE,Sussex County,['Little Assawoman Bay'],['Assawoman Bay Lighthouse Rd Bridge (Route 54)'],['MD3629BL'],"38.45259,-75.06419"
6889762,36.77502,-76.29487,"At approximately 1325 LMT on December, 17, 2019, the empty hopper barge SJ 2620 (O.N. 1264493) pushed by the towing vessel COASTAL TRADER (O.N. 1208724) allided with the fender system of the Norfolk Southern No. 7 Railroad Bridge. The COASTAL TRADER towed the SJ 2620 in a pushing configuration, transiting north on the Southern Branch of the Elizabeth River. As the vessel approached the bridge, the mate on watch reported there was a fuel barge to the east of the southern entrance to the bridge. The mate maneuvered the vessel to avoid close contact with the barge, and aligned the COASTAL TRADER for a clear transit under the bridge. As the vessel proceeded under the bridge, a gust of wind pushed the bow of the barge. The starboard side of the barge’s bow made contact with the east fender system of the bridge. There was an estimated $35,000 of damage to the fender system. The damage did not impact the function of the bridge or restrict the waterway. No injuries or damage to the barge were reported.

As a result of its investigation, the Coast Guard has determined that the initiating event for this casualty was the allision of the barge SJ 2620 with the fender system of the Norfolk Southern No. 7 Railroad Bridge. The causal factors that contributed to this casualty include: (1) weather conditions on the Southern Branch of the Elizabeth River, (2) the impact of the following ebb current on the COASTAL TRADER and SJ 2620, and (3) negligent operation of the mate on watch. 

Recommend closing this incident investigation activity with a referral to enforcement.",VA,Chesapeake city,['Elizabeth River'],['NORFOLK SOUTHERN R/R BRIDGE 7'],"['COASTAL TRADER', 'SJ 2620']","36.77502,-76.29487"
6890288,37.21651,-89.46718,"On 11JAN2020 at approximately 0230 hrs. the ITV STEVE E. BRYAN (Marquette Transportation Co., 537294, 9000HP, COI: CG LMR) was pushing 30 barges (dry cargo) in a 5x7 config. down bound at MM 43.2 UMR when the vessel and tow experienced un-predicted weather with 30MPH wind and heavy rain. This caused the vessel and its tow to be set to the left descending bank. The master was unable to navigate the Thebes Railroad Bridge span and the tow allided with the Thebes RR Bridge left descending pier causing a 20 barges to be set adrift. 10 barges stayed with the vessel, 1 barge grounded on a dike at MM 36.5, 12 barges were grounded at MM 30.6, 2 barges were caught by the ITV PERE MARQUETTE @ MM 23.8. SCC contacted the owner of the Thebes RR Bridge and notified them of the allision, the bridge was inspected with no damage.

Coast Guard investigation revealed the initiating event to be the Allision Contributing Factors include: 1) Weather",MO,Scott County,['MISSISSIPPI-UP'],['THEBES RAILROAD BRIDGE'],"['AGS 276B', 'MTC 401', 'PERE MARQUETTE', 'STEVE E BRYAN', 'JEM 366B', 'AGS 135', 'H 0231', 'H-0245', 'HB-0252', 'HB-0253', 'PML 910', 'SCF 2564 B', 'SCF 2563 B', 'SCF 2576B', 'SCF 2503', 'SCF 2509', 'RF 434B', 'RONNIE ROGERS', 'B 0758B', 'B 0757', 'MTC 1457 B', 'LTD 14108B', 'LTD 15118B']","37.21651,-89.46718"
6890833,30.23821,-93.24647,"On 08NOV2019, at approximately 2200, the Inspected Towing Vessel GRACIE RENEE DEVALL allided with the Westlake RR Bridge resulting in minor damage to the bridge. It was determined that the individual piloting the GRACIE RENEE DEVALL during the allision did not have a valid Merchant Mariner Credential.  Additionally, it was discovered that the GRACIE RENEE DEVALL had been taken out of commision by its previous owner and sold to a third party. The new owner/operator did not have a valid COD on board at the time of the allision.",LA,Calcasieu Parish,['CALCASIEU'],['Westlake Rail Road Bridge'],['GRACIE RENEE DEVALL'],"30.23821,-93.24647"
6891652,37.21685,-89.46644,"On 9 January 2020 at approx 2310, the ITV MARY ELIZABETH while pushing 04 empty tank barges downbound at MM 43.2 UMR, allided with the RDB channel span of the Thebes RR Bridge with the 02 barges on the STBD string. No damage was reported to the bridge, the stbd lead barge was damaged below the water line and is T.O.W. with minor damage to a second barge.

Coast Guard investigation revealed the initiating event was the allision with the Thebes RR Bridge located at MM 43.2 UMR. Contributing factors include wind, current, and pilot's lack of awareness.",IL,Alexander County,['MISSISSIPPI-UP'],['THEBES RAILROAD BRIDGE'],"['STC 1604', 'MARY ELIZABETH', 'STC-3014']","37.21685,-89.46644"
6893043,37.13546,-88.6837,"On 19JAN2019 @ approximately 1000 hrs. the ITV LONNIE M. BELL (LA Carriers, 553742, 1500HP, no COI) was pushing 01 empty deck barge D/B at MM 941 OHR (Metropolis, IL), allided its aluminum superstructure on top of the wheelhouse with the RDB channel span ( Low water span) of the I-24 Highway Bridge. Damaging the upper pilot house causing 3000.00 worth of damage.",KY,McCracken County,['OHIO'],['I-24 HIGHWAY BRIDGE'],['LONNIE M BELL'],"37.13546,-88.6837"
6893290,36.49136,-87.83815,"On 02DEC2019 at approximately 1500, the ITV JOHN VAUGHN (ON 546614, Excell Marine) allided with the Dover, TN Highway 79 bridge, at mile marker 88.8 on the Cumberland River.  Pushing 15 empty hopper barges, the vessel began a down bound flanking maneuver through the bridge at current speed (1-2 mph).  The pilot requested the master come to the bridge to assist him with the flanking maneuver.  The master and pilot described the flank as well executed, but reported a large tree had become stuck between the two lead port string barges that protruded from the tow and may have contacted the bridge.  Damage to the bridge was confirmed to be cosmetic and did not require repairs.  No damage was reported to have occured after the crew's assesment of the barges in tow except for two coupling wires between the forward and second string.

The Coast Guard investigation determined that a bridge allision did occur, causing cosmetic damage to the bridge and breaking two tow couplings.  It could not be verified if debris was a causal factor to the casualty.  No repairs were necessary.",TN,Stewart County,['CUMBERLAND'],['Sidney C. Lewis Highway Bridge (US Highway 79)'],['JOHN VAUGHN'],"36.49136,-87.83815"
6893291,37.02622,-88.28587,"On January 9, 2020 at approx 0635, the ITV JAMES K. ELLIS, pushing 15 empty barges downbound at MM 21 Tennessee River, lost the main engine of the single engine vessel.  The loss of propulsion caused the vessel's tow to allide with the I-24 HWY bridge pier. Allision did not cause any damage to the barges in tow or the bridge pier. 

CG Investigation determined the initiating event was the failure of the racor fuel filter causing fuel to run out of engine. Alson found leaking hose on air control unit.  Contributing factors include lack of proper inspection and maintenance.",KY,Livingston County,['TENNESSEE'],['I-24 DUAL BRIDGES'],"['JAMES K. ELLIS', 'CTC-9724']","37.02622,-88.28587"
6893709,32.23762,-88.01522,"On January 21, 2019 at approx 1500 the ITV ALBERT allided with railroad bridge at MM 173 on the Tombigbe River. The ITV was headed southbound with two empty barges when the starboard quarter of barge EMS 370 made contact with the bridge. No damage was reported from the bridge and an initial estimate of 2k was reported from the barge. No injuries or other incidents were reported to the USCG. The allision occured during a high water event.",AL,Choctaw County,['TOMBIGBEE'],['NAHEOLA BRIDGE'],"['ALBERT', 'EMS 370']","32.23762,-88.01522"
6894940,37.14856,-88.39943,"ON JANUARY 9, 2020, the ITV JONATHAN T. ERICKSON was 15 loaded barges downboaud at MM 2.8 on the Cumberland River approaching the Smithland Bridge.  As the pilot was attempting to transit under the bridge span, unexpected current set his tow to port causing the 2nd barge back from the port head struck the left descending bridge pier.  The allision caused damage to the port side of the rock barge MTC-260B, and minor flooding the #4 wing tank. Barge was taken to Cairo fleet for offload and repairs.  No damage noted to the bridge pier.

CG investigation determined the initiating event as unexpected strength of the current under the bridge span. Higher winds and faster current often occur under bridge spans dependent on river stages and  certain wind direction.  Contributing factor includes pilot lack of awareness of stronger currents and immediate effect on his tow.",KY,Livingston County,['CUMBERLAND'],['LUCY JEFFERSON LEWIS MEMORIAL BRIDGE'],"['JONATHAN ERICKSON', 'MTC 260B']","37.14856,-88.39943"
6899275,34.05588,-77.89938,"On January 28, 2020, at approx. 0900, the recreational sailing vessel SPARTAN II was underway from the Carolina Beach Boat Basin with one operator and one passenger onboard conducting a pre-purchase sea trial.  The operator navigated the vessel with the main sail and jib unfurled, but under primary propulsion of the main engine.  The vessel  transited upon the Atlantic Intracoastal Waterway (AICW) on a southerly course toward the Cape Fear River via Snow's Cut during high tide.  At approx. 1030, the vessel approached the AICW US Highway 421 Carolina Beach Rd. Bridge, also known as, Snow's Cut Bridge.  The vessel was transiting at approx. 2-knots when it passed under the bridge span at the center of the navigable channel.  While transiting below the bridge, the vessel's weather antenna mounted atop the main mast struck the center channel navigation light suspended beneath the bridge span. 

The navigation light broke from its mounted position and plunged into the water adjacent to the vessel's stern.  The operator realized what occurred, terminated the voyage, and turned the vessel around on a northerly course.  The vessel transited under the bridge a second time without further incident and returned to Carolina Beach Boat Basin where it was safely moored.  The operator and passenger notified the owner of the incident and departed the vessel. A Good Samaritan witness and the North Carolina Department of Transportation notified the Coast Guard of the vessel's mast alliding and damaging the bridge channel aid to navigation light. 

As a result of its investigation, the Coast Guard determined the initiating event for this casualty was the SAPRTAN II’s equipment mounted atop the main mast struck the Snow’s Cut Bridge center channel navigation light. The causal factors that contributed to this casualty include: (1) the operator was not aware of the height of the vessel’s main mast, including associated mounted equipment, prior to transiting under the fixed bridge; (2) the height of the vessel’s main mast, including associated mounted equipment, was greater than the fixed bridge 65-ft clearance.",NC,New Hanover County,['Myrtle Grove Sound'],['AICW US 421 Carolina Beach Rd Bridge'],['SPARTAN II'],"34.05588,-77.89938"
6901856,41.88746,-87.63262,"On January 29, 2020, at approximately 2114 (CST) the Inspected Passenger Vessel ODYSSEY CHICAGO RIVER (O.N. 1285650) was transiting underneath the LaSalle Bridge on the Chicago River at MM 326 when a cable hanging from the bridge struck the vessel's radar making it inoperable. The low hanging cable was part of the equipment being used by a construction company for bridge work.

As a result of its investigation, the Coast Guard has determined that the initiating event for this casualty was the cable hanging down below the allowable distance preventing the vessel from safely transiting the bridge, followed the allision and damage to the radar.",IL,Cook County,['IL WWY N.'],['LaSalle Street Drawbridge'],['ODYSSEY CHICAGO RIVER'],"41.88746,-87.63262"
6902340,40.63839,-74.19648,"On 30 January 2020 at approximately 0710 local time the Marshall Islands flagged vessel THE AMIGO (IMO 9492309) was in process of docking at CL Asphalt, Elizabeth, NJ, when the vessel allided with the Arthur Kills Rail Road Bridge. The bow of the vessel THE AMIGO was visibly externally damaged expanding an approximate 5' by 5' area of the forward bow section bulwark, from above the main deck. The Arthur Kills Rail Road Bridge had visible damage consisting of two frames inset and damage to an electrical line. 

As a result of this investigations, the Coast Guard has determined that the initiating event was the allision of THE AMIGO to the Arthur Kills Rail Road Bridge. The casual factors that contributed to this casualty include; (1) Failure of Master's attention to input of vessel pitch, and (2) a failure of communication between the Master and the Docking Pilot.",NJ,Union County,['Arthur Kill'],['Arthur Kill RR Bridge'],['THE AMIGO'],"40.63839,-74.19648"
6910524,37.12989,-88.6883,"On 18FEB20 @ 0148 the ITV JACIE E ( ON# 263098, 2800 HP, Excel Marine) was DWNB OHR @ MM 941 pushing 4 empty cement barges when the barge allided with the I-24 bridge, causing 3 barges to be set adrift. All 3 barges grounded @ MM 941 LDB. The vessel recovered all 3 barges and placed them back into the tow. The master stated that he went thru the navigational pass at L&D 52 and was set by wind and current as he was making his way to the high water span on the Kentucky side. Investigation revealed that the Master did not use the high water navigational pass over the bear traps at Lock& Dam 52 that was open at the time to prevent bridge allisions.

Coast Guard investigation revealed the initiating event to be Bridge Allision. Factors include: 1) Loss Of Situational Awareness 2) Failure to use all available means to safely navigate. Lack of awareness of current navigation status of rivers.",KY,McCracken County,['OHIO'],['I-24 HIGHWAY BRIDGE'],"['JACIE E', 'LSI 1508', 'LSI 3205', 'LSI-3201']","37.12989,-88.6883"
6910950,29.94558,-90.3745,"On 30 January 2020 at approximately 0450 local time, the loaded dry cargo barge MBL 984 broke away from the ITV MARY PARKER's tow, while moored in the fleet at mile marker 122 Lower Mississippi River, and allided with the fendering system of the Luling Bridge.

The Master of the ITV MARY PARKER said prior to the breakaway, they were holding a tier of 7 loaded dry cargo barges and 2 empties in the fleeting area. A fleeting barge was setting their tow when the facing wire holding the MBL 984 broke, allowing the barge to drift with the river current approximately 450 feet down river before striking the Luling Bridge fender system. The Master was able to collect the barge and re-set the tow. LADOT reported no damage to the bridge fender system and the owner of the MBL 984 reported damages of <$75K to the barge.

As a result of its investigation, the Coast Guard has determined that this incident is a reportable Marine Casualty in accordance with 46 CFR Part 4. The level of investigation effort meets the requirements for a data collection. The Coast Guard determined the initiating event was the material failure of the facing wires on the barge, subsequent events being the barge being set adrift and the allision with the bridge.",LA,St. Charles Parish,['MISSISSIPPI-LO'],['Luling Bridge (I-310)'],"['MARY PARKER', 'MBL 984']","29.94558,-90.3745"
6911128,39.11268,-94.58862,"On 27 January, 2020 at approx 1700, the ITV BETTTY FEAGIN (O.N. 501619) was transiting north bound pushing one loaded scrap steal barge, MEM 5111 (O.N. 1061412), on the Missouri River (MOR) at approximately mile marker (MM) 366.2 when the barge ran aground on a sandbar outside of the navigable channel. The Master was in the process of navigating the left descending span of the Hannibal Railroad Drawbridge when the tow got set off towards the left descending bank (LDB) of the river. Because the Master misjudged the river conditions, it caused the head of the tow to put them on track to allide with the upstream bridge pier for the Broadway Ave Hwy Bridge. In an effort to avoid the allision, the Master turned the tow to starboard. Because of this abrupt maneuver and with the tow now somewhat perpendicular to the river current, the tow began to top around. In an effort to avoid the tow from coming completely topping around and possibly alliding with the downriver bridge (Hannibal Railroad Drawbridge) the Master came ahead on the ITV and intentionally grounded the tow on a sandbar along the LDB just outside of the channel. Due to the proximity to the LDB bride pier for the Broadway Ave Hwy Bridge, the Master was unable to make an attempt to unground the barge and had to await assistance from another ITV.  An assist vessel arrived on scene at 0800 the following morning and refloated the MEM 5111.  The barge was surveyed by the crew for damage; all sat.",MO,Jackson County,['MISSOURI'],"['BROADWAY AVENUE HIGHWAY BRIDGE', 'HANNIBAL RAILROAD DRAWBRIDGE (SWING)']","['BETTY FEAGIN', 'MEM 5111']","39.11268,-94.58862"
6912234,36.72359,-76.18744,"On February 11, 2020, the towing vessel MERRIMAC (O.N. 512840) was pushing the empty hopper barge SJ 700 (O.N. 651528) west along the Albemarle and Chesapeake Canal en route from North Carolina to Maryland. The Mate was operating MERRIMAC and attempted to line up the towing vessel and barge to transit through the Centerville Turnpike bridge fender system. The wind at the time was out of the southwest and the Mate slowed the towing vessel to approximately two knots in order to transit safely through the fender system. At approximately 0310 LMT, the starboard bow of SJ 700 made contact with the northeast fender system for the Centerville Turnpike bridge. The fender system was already damaged from a previous vessel allision, and the bow of SJ 700 did not cause any additional damage to the Centerville Turnpike bridge fender system. The force of the allusion caused the bow of SJ 700 to travel back into the channel and the towing vessel and barge transited through the bridge fender system without further issue. A small inset was identified in the bow of SJ 700 as a result of the incident, but the barge owners declined to repair the damage or seek any form of financial compensation for the incident. 

As a result of its investigation, the Coast Guard has determined that the initiating event for this casualty was the allision between SJ 700 and the Centerville Turnpike bridge fender system. The causal factors that contributed to this incident include: (1) the wind blowing the bow of the barge starboard towards the north side fender system, and (2) the slow speed of the transit that reduced vessel maneuverability.

Recommend closing this incident investigation activity without a referral to an enforcement activity.",VA,Chesapeake city,['A. & C. Canal'],['CENTERVILLE TURNPIKE BRIDGE'],"['MERRIMAC', 'SJ 700']","36.72359,-76.18744"
6913016,37.02534,-88.28468,"On 21FEB2020 @ 0058 hrs. the ITV DANNY L WHITFORD, (HINES FURLONG, 1217464, 4000 HP) was pushing 09 sand barges and 02 empty Red Flag tank barges, was heading down bound at MM 21 TNR leaving Kentucky Lock and Dam. The vessel was assisted by the ITV Maverick and released at the 62 Railroad bridge. As the vessel continued downstream, they were unable to coorect for the bridge span and allided with the left descending pier of the I-24 Highway Bridge. The allision caused the tow to be set adrift and break the starboard wing wire. The broken wire became caught in the starboard wheel causing a Loss Of Propulsion. The ITV NICK LONNEMANN successfully recovered the 09 empty sand barges. 01 Red Flag Barge (KIRBY-28137) remained attached to the ITV DANNY L WHITFORD. The ITV MAVERICK successfully secured the other Tank Barge (HSM-3212) against the bank @ MM 20 TNR. Initial damage estimate was $375,000.00. When the Owner submitted the CG-2692 Damages were at $612,240.00. 

Coast Guard investigation revealed the initiating event to be Bridge Allision Factors include: 1) Loss of Situational Awareness 2) Pilot's lack of understanding where the assist boat was releasing.",KY,Marshall County,['TENNESSEE'],['I-24 DUAL BRIDGES'],"['MAVERICK', 'KIRBY 28137', 'DANNY L WHITFORD', 'HSM 3212', 'NICK LONNEMANN', 'HSG-101']","37.02534,-88.28468"
6913280,37.90525,-87.54739,"On February 19, 2020, at approximately 0315, the ITV Washington was pushing 15 empty hopper barges (3 wide) and was set by wind while attempting to transit the alternate span of the Dade Park Bridge. The master decided to abort the transit and began backing down against the 5 knot current. The tow continued to drift to port, due to the current and wind, and made contact with the RDB bridge pier on the port string 2nd barge. Tow did not break any wires, no damage, injuries, or pollution reported. Bridge inspected by DOT and noted no damage.

As a result of their investigation, the Coast Guard determined that the initiating event for this casualty was the vessel's unexpected maneuver caused by a stronger-than-anticipated north wind.",KY,Henderson County,['OHIO'],['U.S. 41 DUAL BRIDGES'],"['WASHINGTON', 'HB 1739B']","37.90525,-87.54739"
6914309,37.11226,-88.6292,"On 23FEB2020 @ 2315 hrs. the ITV BRANDON G. BUCHANAN (567698, Southern Towing, 6140HP, 8.6' Draft, No COI) was pushing 8 empty hopper barges in a 2X4 config. down bound at MM 937.3 OHR when the tow of the vessel's tow was set by the current as it was transitting under the Irvin Cobb bridge. The set caused the starboard lead barge (STC606) to allide with the right descending pier (KY span) of the Irvin Cobb Bridge (LLNR 28025). Master reports the barge has damage on STBD side and the tow has 3 broken wires. Damage was estimated at $10,000. There was no damage to the bridge.

Coast Guard investigation revealed the initiating event to be Bridge Allision Factors include: 1) Loss of Situational Awareness 2) Wind and current.",KY,McCracken County,['OHIO'],['IRVIN COBB BRIDGE'],"['BRANDON G. BUCHANAN', 'STC-606']","37.11226,-88.6292"
